<?xml version="1.0" encoding="UTF-8"?>

<!--<!DOCTYPE catalog SYSTEM "Catalog.dtd">-->
<catalog xmlns:xsi="http://www.w3.org/2001/XMLSchema-instance" 
         xsi:noNamespaceSchemaLocation="Catelog.xsd">
<!--<catalog>-->
    <book>
        <title>Hello World</title>
        <author>Java</author>
        <author>Java 2</author>
        <publisher>Java Publisher</publisher>
        <bookISBN>
            <bookISBN10>8910101010</bookISBN10> 
        </bookISBN>
    </book>
    <book>
        <title>Good Bye</title>
        <author>C++</author>
        <publisher>C++ Publisher</publisher>
        <bookISBN>
            <bookISBN13>978-1234567890</bookISBN13> 
        </bookISBN>
    </book>
</catalog>

